{
  "meta": {
    "gameTitle": "The Compounding Illusion",
    "gameVersion": "0.4.0"
  },
  "playerExperience": {
    "numberFormatting": "scientific",
    "uiDirectives": {
      "showProductionRates": true,
      "showEfficiencyScores": true,
      "liveSurroundings": true
    }
  },
  "coreLoop": {
    "primaryCurrency": {
      "id": "insight",
      "name": "Insight",
      "initialValue": 0
    },
    "manualClickValue": {
      "baseValue": 1
    }
  },
  "generators": [
    {
      "id": "gen01_thought",
      "name": "Fleeting Thought",
      "description": "Generates raw Insight by simply existing.",
      "baseCost": 10,
      "costScaling": 1.15,
      "output": { "type": "currency", "targetId": "insight", "baseRate": 1 },
      "milestoneBonuses": [
        { "level": 10, "effect": { "type": "multiplier", "targetId": "gen01_thought", "targetProperty": "production", "value": 2 }, "lore": "Initial thoughts double, a cascade begins." },
        { "level": 25, "effect": { "type": "multiplier", "targetId": "global", "targetProperty": "production", "value": 1.1 } },
        { "level": 50, "effect": { "type": "additive_bonus", "targetId": "gen01_thought", "targetProperty": "production", "value": 5 } }
      ]
    },
    {
      "id": "gen02_note",
      "name": "Scribbled Note",
      "description": "Captures fleeting thoughts, making them more tangible.",
      "baseCost": 150,
      "costScaling": 1.20,
      "output": { "type": "currency", "targetId": "insight", "baseRate": 10 },
      "milestoneBonuses": [
        { "level": 10, "effect": { "type": "multiplier", "targetId": "gen02_note", "targetProperty": "production", "value": 2 } },
        { "level": 25, "effect": { "type": "multiplier", "targetId": "gen01_thought", "targetProperty": "production", "value": 1.5 } },
        { "level": 50, "effect": { "type": "multiplier", "targetId": "global", "targetProperty": "production", "value": 1.25 }, "lore": "Notes begin to influence the very fabric of thought." }
      ]
    },
    {
      "id": "gen03_researcher",
      "name": "Researcher",
      "description": "A dedicated mind that continuously generates new scribbled notes.",
      "baseCost": 2500,
      "costScaling": 1.25,
      "output": { "type": "generator", "targetId": "gen02_note", "baseRate": 0.5 },
      "milestoneBonuses": [
        { "level": 5, "effect": { "type": "multiplier", "targetId": "gen03_researcher", "targetProperty": "production", "value": 2 } },
        { "level": 15, "effect": { "type": "multiplier", "targetId": "gen02_note", "targetProperty": "production", "value": 1.2 } },
        { "level": 30, "effect": { "type": "multiplier", "targetId": "global", "targetProperty": "production", "value": 1.5 }, "lore": "Early research finds its footing, connecting disparate ideas." }
      ]
    },
    {
      "id": "gen04_conceptual_model",
      "name": "Conceptual Model",
      "description": "Frameworks that produce more researchers and streamline thought.",
      "baseCost": 30000,
      "costScaling": 1.30,
      "output": { "type": "generator", "targetId": "gen03_researcher", "baseRate": 0.2 },
      "milestoneBonuses": [
        { "level": 5, "effect": { "type": "multiplier", "targetId": "gen04_conceptual_model", "targetProperty": "production", "value": 2 } },
        { "level": 10, "effect": { "type": "multiplier", "targetId": "gen01_thought", "targetProperty": "production", "value": 3 } },
        { "level": 20, "effect": { "type": "multiplier", "targetId": "gen03_researcher", "targetProperty": "production", "value": 1.5 }, "lore": "Models simplify reality, making new insights possible." }
      ]
    },
    {
      "id": "gen05_peer_review",
      "name": "Peer Review",
      "description": "Refines models, significantly boosting their effectiveness.",
      "baseCost": 350000,
      "costScaling": 1.35,
      "output": { "type": "generator", "targetId": "gen04_conceptual_model", "baseRate": 0.1 },
      "milestoneBonuses": [
        { "level": 3, "effect": { "type": "multiplier", "targetId": "gen05_peer_review", "targetProperty": "production", "value": 2 } },
        { "level": 7, "effect": { "type": "multiplier", "targetId": "gen04_conceptual_model", "targetProperty": "production", "value": 1.8 } },
        { "level": 15, "effect": { "type": "multiplier", "targetId": "global", "targetProperty": "production", "value": 1.75 }, "lore": "The scrutiny of peers hones the sharpness of your models." }
      ]
    },
    {
      "id": "gen06_published_paper",
      "name": "Published Paper",
      "description": "Formalizes research, creating more peer reviews and accelerating the flow of ideas.",
      "baseCost": 4000000,
      "costScaling": 1.40,
      "output": { "type": "generator", "targetId": "gen05_peer_review", "baseRate": 0.08 },
      "milestoneBonuses": [
        { "level": 2, "effect": { "type": "multiplier", "targetId": "global", "targetProperty": "production", "value": 2.5 } },
        { "level": 5, "effect": { "type": "multiplier", "targetId": "gen05_peer_review", "targetProperty": "production", "value": 1.5 } },
        { "level": 10, "effect": { "type": "additive_bonus", "targetId": "gen06_published_paper", "targetProperty": "production", "value": 100000 }, "lore": "Each publication lays a new brick in the edifice of understanding." }
      ]
    },
    {
      "id": "gen07_academic_conference",
      "name": "Academic Conference",
      "description": "Spreads knowledge, creating more published papers and boosting global insight.",
      "baseCost": 50000000,
      "costScaling": 1.45,
      "output": { "type": "generator", "targetId": "gen06_published_paper", "baseRate": 0.05 },
      "milestoneBonuses": [
        { "level": 1, "effect": { "type": "multiplier", "targetId": "gen07_academic_conference", "targetProperty": "production", "value": 3 } },
        { "level": 3, "effect": { "type": "multiplier", "targetId": "global", "targetProperty": "production", "value": 1.8 } },
        { "level": 7, "effect": { "type": "additive_bonus", "targetId": "gen06_published_paper", "targetProperty": "production", "value": 500000 }, "lore": "The cross-pollination of ideas at conferences sparks new growth." }
      ]
    },
    {
      "id": "gen08_global_collaboration",
      "name": "Global Collaboration",
      "description": "Unites minds worldwide, exponentially increasing the output of academic conferences.",
      "baseCost": 600000000,
      "costScaling": 1.50,
      "output": { "type": "generator", "targetId": "gen07_academic_conference", "baseRate": 0.01 },
      "milestoneBonuses": [
        { "level": 1, "effect": { "type": "multiplier", "targetId": "gen08_global_collaboration", "targetProperty": "production", "value": 4 } },
        { "level": 2, "effect": { "type": "multiplier", "targetId": "gen07_academic_conference", "targetProperty": "production", "value": 2 } },
        { "level": 4, "effect": { "type": "multiplier", "targetId": "global", "targetProperty": "production", "value": 2.5 }, "lore": "Humanity's collective intellect surges forward in unison." }
      ]
    },
    {
      "id": "gen09_paradigm_shift",
      "name": "Paradigm Shift Generator",
      "description": "A fundamental re-framing of reality, massively boosting all forms of insight generation.",
      "baseCost": 7500000000,
      "costScaling": 1.55,
      "output": { "type": "currency", "targetId": "insight", "baseRate": 10000000 },
      "milestoneBonuses": [
        { "level": 1, "effect": { "type": "multiplier", "targetId": "global", "targetProperty": "production", "value": 5 } },
        { "level": 2, "effect": { "type": "multiplier", "targetId": "gen08_global_collaboration", "targetProperty": "production", "value": 3 } },
        { "level": 3, "effect": { "type": "additive_bonus", "targetId": "gen09_paradigm_shift", "targetProperty": "production", "value": 50000000 }, "lore": "The world looks different now, seen through a new lens." }
      ]
    },
    {
      "id": "gen10_universal_understanding",
      "name": "Universal Understanding",
      "description": "The ultimate state of knowledge, transcending all previous forms of insight.",
      "baseCost": 100000000000,
      "costScaling": 1.50,
      "output": { "type": "currency", "targetId": "insight", "baseRate": 100000000 },
      "milestoneBonuses": [
        { "level": 1, "effect": { "type": "multiplier", "targetId": "global", "targetProperty": "production", "value": 10 } },
        { "level": 2, "effect": { "type": "multiplier", "targetId": "gen09_paradigm_shift", "targetProperty": "production", "value": 5 } },
        { "level": 3, "effect": { "type": "additive_bonus", "targetId": "gen10_universal_understanding", "targetProperty": "production", "value": 1000000000 }, "lore": "The universe itself whispers its secrets." }
      ]
    }
  ],
  "upgrades": [
    {
      "id": "upg01_focused_attention",
      "name": "Focused Attention",
      "description": "Doubles the output of Fleeting Thoughts.",
      "cost": 100,
      "unlockConditions": [ { "type": "generator_owned", "targetId": "gen01_thought", "value": 10 } ],
      "effect": { "type": "multiplier", "targetId": "gen01_thought", "targetProperty": "production", "value": 2 }
    },
    {
      "id": "upg02_organized_notes",
      "name": "Organized Notes",
      "description": "Scribbled Notes are twice as effective.",
      "cost": 1200,
      "unlockConditions": [ { "type": "generator_owned", "targetId": "gen02_note", "value": 5 } ],
      "effect": { "type": "multiplier", "targetId": "gen02_note", "targetProperty": "production", "value": 2 }
    },
    {
      "id": "upg03_dedicated_research",
      "name": "Dedicated Research",
      "description": "Researchers are 2.5x more productive.",
      "cost": 15000,
      "unlockConditions": [ { "type": "generator_owned", "targetId": "gen03_researcher", "value": 5 } ],